{
  "schema_version": "1.0.0",
  "product_spec_version": "0.9.4-draft",
  "ui_spec_version": "0.7.0-draft",
  "route_contract_schema_version": "1.0.0",
  "source_files": [
    "custometry-technical-blueprint-ru.md",
    "custometry-technical-blueprint-human-ru.md",
    "custometry-ui-blueprint-ru.md",
    "packages/contracts/routes/ui-routes.json",
    "packages/contracts/routes/ui-route-contracts.json"
  ],
  "route_decision_policy": {
    "route_when": [
      "durable entity or version lifecycle",
      "notification audit or bookmark deep link",
      "independent Back refresh or unsaved-change semantics",
      "independent permission boundary with complex recoverable state"
    ],
    "overlay_when": [
      "transient confirmation or contextual inspection",
      "no independent durable lifecycle",
      "return to an owning route is always required"
    ],
    "component_when": [
      "the same governed behavior is reused across several routes",
      "the behavior has no independent resource identity",
      "consistent rendering and accessibility are more important than a new URL"
    ],
    "route_count_is_ceiling": false
  },
  "penpot_baseline": {
    "file_id": "7cd71457-8d32-8044-8008-549f83bb4645",
    "working_name": "custometry",
    "observed_revision": 213,
    "page_count": 49,
    "verified_route_count": 116,
    "target_route_count": 117
  },
  "overlays": [
    {"id": "UI-OVR-001", "name": "Workspace switcher", "kind": "popover", "route_backed": false, "history_semantics": "none", "requirement_ids": ["ROUTE-010"]},
    {"id": "UI-OVR-002", "name": "Global command palette", "kind": "popover", "route_backed": false, "history_semantics": "none", "requirement_ids": ["ROUTE-003", "ROUTE-005", "RBAC-006"]},
    {"id": "UI-OVR-003", "name": "Searchable Filter Explorer", "kind": "drawer", "route_backed": false, "history_semantics": "replace", "requirement_ids": ["FILTER-002", "FILTER-005", "FILTER-007", "FILTER-008"]},
    {"id": "UI-OVR-004", "name": "Filter expression editor", "kind": "drawer", "route_backed": false, "history_semantics": "replace", "requirement_ids": ["FILTER-001", "FILTER-003", "FILTER-004", "FILTER-009", "FILTER-010"]},
    {"id": "UI-OVR-005", "name": "Previous-year comparison editor", "kind": "drawer", "route_backed": false, "history_semantics": "replace", "requirement_ids": ["UC-012", "COMPARE-001", "COMPARE-002", "COMPARE-003", "COMPARE-004", "COMPARE-005", "COMPARE-006", "COMPARE-007"]},
    {"id": "UI-OVR-006", "name": "Result Trust drawer", "kind": "drawer", "route_backed": false, "history_semantics": "none", "requirement_ids": ["REPORT-008", "UX-JOURNEY-005"]},
    {"id": "UI-OVR-007", "name": "Chart data table", "kind": "drawer", "route_backed": false, "history_semantics": "none", "requirement_ids": ["CHART-015", "A11Y-006", "A11Y-007"]},
    {"id": "UI-OVR-008", "name": "Publish diff and impact modal", "kind": "modal", "route_backed": false, "history_semantics": "none", "requirement_ids": ["OBJ-STATE-002", "UX-JOURNEY-006"]},
    {"id": "UI-OVR-009", "name": "Clone/deprecate/archive modal", "kind": "modal", "route_backed": false, "history_semantics": "none", "requirement_ids": ["OBJ-STATE-001", "OBJ-STATE-003"]},
    {"id": "UI-OVR-010", "name": "Operation progress drawer", "kind": "drawer", "route_backed": false, "history_semantics": "none", "requirement_ids": ["PROGRESS-001", "PROGRESS-002", "PROGRESS-003", "PROGRESS-004", "PROGRESS-005", "PROGRESS-006", "PROGRESS-007", "PROGRESS-008"]},
    {"id": "UI-OVR-011", "name": "Cancel/retry/rerun confirmation", "kind": "modal", "route_backed": false, "history_semantics": "none", "requirement_ids": ["PROGRESS-006"]},
    {"id": "UI-OVR-012", "name": "Export preflight modal", "kind": "modal", "route_backed": false, "history_semantics": "none", "requirement_ids": ["UC-015", "REPORT-009", "XLSX-006", "RBAC-005"]},
    {"id": "UI-OVR-013", "name": "Email send confirmation", "kind": "modal", "route_backed": false, "history_semantics": "none", "requirement_ids": ["UC-014", "REPORT-MAIL-001", "REPORT-MAIL-002", "REPORT-MAIL-003", "REPORT-MAIL-004", "REPORT-MAIL-005", "RBAC-005"]},
    {"id": "UI-OVR-014", "name": "Promotion item detail drawer", "kind": "drawer", "route_backed": false, "history_semantics": "none", "requirement_ids": ["UC-013", "PROMO-001", "PROMO-002", "PROMO-003", "PROMO-004", "PROMO-005", "PROMO-006", "PROMO-007", "PROMO-008", "PROMO-009"]},
    {"id": "UI-OVR-015", "name": "Pipeline node inspector", "kind": "drawer", "route_backed": false, "history_semantics": "none", "requirement_ids": ["UC-006", "OBJ-STATE-004"]},
    {"id": "UI-OVR-016", "name": "Notification detail drawer", "kind": "drawer", "route_backed": false, "history_semantics": "none", "requirement_ids": ["NOTIFY-001", "NOTIFY-002", "NOTIFY-003", "NOTIFY-004", "NOTIFY-005", "NOTIFY-006", "NOTIFY-007", "NOTIFY-008", "NOTIFY-009", "NOTIFY-010", "NOTIFY-011", "NOTIFY-012", "NOTIFY-013", "NOTIFY-014", "NOTIFY-015"]},
    {"id": "UI-OVR-017", "name": "Theme switcher", "kind": "popover", "route_backed": false, "history_semantics": "replace", "requirement_ids": ["THEME-001", "THEME-002", "THEME-003", "THEME-004", "THEME-005", "THEME-006", "THEME-007", "THEME-008"]},
    {"id": "UI-OVR-018", "name": "Permission/forbidden explanation", "kind": "popover", "route_backed": false, "history_semantics": "none", "requirement_ids": ["RBAC-002", "RBAC-006", "UX-JOURNEY-006"]},
    {"id": "UI-OVR-019", "name": "Destructive action confirmation", "kind": "modal", "route_backed": false, "history_semantics": "none", "requirement_ids": ["OBJ-STATE-001", "OBJ-STATE-003"]},
    {"id": "UI-OVR-020", "name": "Full-screen Focus / Explore Surface", "kind": "route_surface", "route_backed": true, "history_semantics": "push_return_to_origin", "requirement_ids": ["UC-018", "FOCUS-001", "FOCUS-002", "FOCUS-003", "FOCUS-004", "FOCUS-005", "FOCUS-006", "FOCUS-007", "FOCUS-008", "FOCUS-009", "FOCUS-010", "FOCUS-011", "FOCUS-012"]},
    {"id": "UI-OVR-021", "name": "Help and contextual-help menu", "kind": "popover", "route_backed": false, "history_semantics": "none", "requirement_ids": ["HELP-001", "HELP-003", "HELP-004"]},
    {"id": "UI-OVR-022", "name": "Keyboard shortcuts reference", "kind": "modal", "route_backed": false, "history_semantics": "none", "requirement_ids": ["HELP-002", "HELP-004"]},
    {"id": "UI-OVR-023", "name": "Unsaved changes confirmation", "kind": "modal", "route_backed": false, "history_semantics": "none", "requirement_ids": ["ROUTE-008"]},
    {"id": "UI-OVR-024", "name": "Discussion and comments drawer", "kind": "drawer", "route_backed": false, "history_semantics": "replace", "requirement_ids": ["UC-021", "RESEARCH-005", "RESEARCH-006", "RESEARCH-007", "RBAC-014"]},
    {"id": "UI-OVR-025", "name": "Data treatment and sensitivity drawer", "kind": "drawer", "route_backed": false, "history_semantics": "replace", "requirement_ids": ["UC-025", "OUTLIER-001", "OUTLIER-002", "OUTLIER-003", "OUTLIER-004", "OUTLIER-005", "OUTLIER-006", "OUTLIER-007", "OUTLIER-008", "OUTLIER-009", "OUTLIER-010", "OUTLIER-011", "OUTLIER-012", "SEGMENT-018"]}
  ],
  "system_surfaces": [
    {"id": "UI-SYS-001", "name": "403 Forbidden", "requirement_ids": ["SYS-UI-001"]},
    {"id": "UI-SYS-002", "name": "404 Not Found", "requirement_ids": ["SYS-UI-002"]},
    {"id": "UI-SYS-003", "name": "Session expired", "requirement_ids": ["SYS-UI-003"]},
    {"id": "UI-SYS-004", "name": "Maintenance", "requirement_ids": ["SYS-UI-004"]},
    {"id": "UI-SYS-005", "name": "Upgrade required", "requirement_ids": ["SYS-UI-005"]}
  ],
  "cross_surface_capabilities": [
    {"id": "UI-CAP-001", "name": "Workspace routing, guards and return", "delivery_form": "route_state_contract", "requirement_ids": ["ROUTE-001", "ROUTE-002", "ROUTE-003", "ROUTE-004", "ROUTE-005", "ROUTE-006", "ROUTE-007", "ROUTE-008", "ROUTE-009", "ROUTE-010", "ROUTE-011", "ROUTE-012", "RBAC-002"]},
    {"id": "UI-CAP-002", "name": "Searchable typed filters", "delivery_form": "component_contract", "requirement_ids": ["FILTER-001", "FILTER-002", "FILTER-003", "FILTER-004", "FILTER-005", "FILTER-006", "FILTER-007", "FILTER-008", "FILTER-009", "FILTER-010"]},
    {"id": "UI-CAP-003", "name": "Previous-year comparison", "delivery_form": "component_contract", "requirement_ids": ["UC-012", "COMPARE-001", "COMPARE-002", "COMPARE-003", "COMPARE-004", "COMPARE-005", "COMPARE-006", "COMPARE-007"]},
    {"id": "UI-CAP-004", "name": "Metric groups and adaptive formats", "delivery_form": "component_contract", "requirement_ids": ["METRIC-009", "METRIC-010", "METRIC-011", "METRIC-012", "METRIC-013", "METRIC-014", "METRIC-015", "METRIC-016"]},
    {"id": "UI-CAP-005", "name": "ChartSpec visualization", "delivery_form": "component_contract", "requirement_ids": ["UC-017", "CHART-001", "CHART-002", "CHART-003", "CHART-004", "CHART-005", "CHART-006", "CHART-007", "CHART-008", "CHART-009", "CHART-010", "CHART-011", "CHART-012", "CHART-013", "CHART-014", "CHART-015", "CHART-016", "CHART-017", "CHART-018", "CHART-019"]},
    {"id": "UI-CAP-006", "name": "Chart ↔ Data table", "delivery_form": "component_contract", "requirement_ids": ["CHART-015", "A11Y-006", "A11Y-007"]},
    {"id": "UI-CAP-007", "name": "Focus / Explore", "delivery_form": "route_state_contract", "requirement_ids": ["UC-018", "FOCUS-001", "FOCUS-002", "FOCUS-003", "FOCUS-004", "FOCUS-005", "FOCUS-006", "FOCUS-007", "FOCUS-008", "FOCUS-009", "FOCUS-010", "FOCUS-011", "FOCUS-012"]},
    {"id": "UI-CAP-008", "name": "Result Trust", "delivery_form": "component_contract", "requirement_ids": ["REPORT-008", "UX-JOURNEY-005"]},
    {"id": "UI-CAP-009", "name": "Research composition and findings", "delivery_form": "component_contract", "requirement_ids": ["UC-020", "RESEARCH-001", "RESEARCH-002", "RESEARCH-003", "RESEARCH-004", "RESEARCH-005", "RESEARCH-006", "RESEARCH-007", "RESEARCH-008"]},